### ISSUE TITLE
problem connecting to 2640A

### ISSUE THREAD

**Issue by fenugrec** [Doridian/NetDAQ#57]
I edited `__main.py__` to run the `main` demo function instead of main3 and getting the following output: 

```
Base channel 1
Version info [b'2640A', b'\xc0DMM02.00', b'BM02.08', b'PA01.00', b'BA00.09']
LC version [b'LC01.00']
Time set!
Clean shutdown...
Done!
Traceback (most recent call last):
  File "<frozen runpy>", line 198, in _run_module_as_main
  File "<frozen runpy>", line 88, in _run_code
  File "/home/q/d/fluke/netdaq/__main__.py", line 80, in <module>
    run(main())
    ~~~^^^^^^^^
  File "/usr/lib/python3.13/asyncio/runners.py", line 195, in run
    return runner.run(main)
           ~~~~~~~~~~^^^^^^
  File "/usr/lib/python3.13/asyncio/runners.py", line 118, in run
    return self._loop.run_until_complete(task)
           ~~~~~~~~~~~~~~~~~~~~~~~~~~~~~^^^^^^
  File "/usr/lib/python3.13/asyncio/base_events.py", line 725, in run_until_complete
    return future.result()
           ~~~~~~~~~~~~~^^
  File "/home/q/d/fluke/netdaq/__main__.py", line 45, in main
    await instrument.set_config(
    ...<16 lines>...
    )
  File "/home/q/d/fluke/netdaq/lib/netdaq.py", line 317, in set_config
    _ = await self.send_rpc(DAQCommand.SET_CONFIG, payload=payload)
        ^^^^^^^^^^^^^^^^^^^^^^^^^^^^^^^^^^^^^^^^^^^^^^^^^^^^^^^^^^^
  File "/home/q/d/fluke/netdaq/lib/netdaq.py", line 209, in send_rpc
    return await response_future
           ^^^^^^^^^^^^^^^^^^^^^
lib.netdaq.ResponseErrorCodeException: Response error: ffffffff
```

As far as I can tell in a wireshark capture , the traffic near the end looks like this : 

- command 0x81 + 2508 bytes
- response : TCP ACK (possibly just for the segmented packets, not sure)
- resp: FFFFFFFF, payload FFFFFFFE (unclear what error code this would be)
- cmd 0x76 monitor_off
- no response
- cmd 0x68 STOP with a strange payload (should probably have no payload at all ?)
```
Transmission Control Protocol, Src Port: 41988, Dst Port: 4369, Seq: 3689, Ack: 1489, Len: 32
netdaq Protocol Data
    seq_id: 76
    cmd: 0x00000068 STOP
    pkt_len: 16
    payload: 46454c580000004d0000007d00000010
```
that payload looks like it contains a whole nested packet ? (same FELX header; seq number is incremented and the command is 0x7D disable_spy)
- cmd 0x01 close conn

**Comment by Doridian** [comment]
The stop already happens when stuff broke. Something is off there but the real issue is the error response to the set configuration packet.
I might check on my own unit tomorrow to see where exactly stuff went wrong...

**Comment by fenugrec** [comment]
Forgot to attach the packet capture : 
[netdaq fail.pcapng.zip](https://github.com/user-attachments/files/19043230/netdaq.fail.pcapng.zip)

You might try the dissector I just PR'd, let me know what you think.

**Comment by Doridian** [comment]
I figured the issue out: Some NetDAQ instruments do not support the new feature I added recently (disabling earlier channels while using later channels, for example using channel 3 but keeping 1 and 2 disabled).
I'll add an error that if `set_config` fails and such a configuration is trying to be pushed it will explicitly state that this is known to cause some instruments to reject the packet.

**Comment by fenugrec** [comment]
Cool!  What version strings does your unit return ?
I've never seen firmware update files from Fluke but I know the capability exists based on the service manual. Wonder if it's a later addition.

**Comment by Doridian** [comment]
> Cool! What version strings does your unit return ? I've never seen firmware update files from Fluke but I know the capability exists based on the service manual. Wonder if it's a later addition.

In fact, you'd have to ask the creator of this issue: https://github.com/Doridian/NetDAQ/issues/53

They confirmed it worked on their instrument, so I got lazy and didn't test it on my own.
My own, in fact, does not. (That is how I confirmed this issue just now, heh)

**Comment by fenugrec** [comment]
Pulled in your most recent changes and ran again - unfortunately, still having same error. Eth capture nearly identical (attached below); now that I have some basic dissecting working, I noticed a few things now : 

- early in the init sequence, STOP 0x68 command is followed by an Error 0xFFFFFFFB response; any idea why ?
- both times, SET_CONFIG response is Error 0xfffffffe. I do see that the contents of the payload has changed
- there is still that TCP packet with two concatenated requests (DISABLE_SPY and CLOSE_CONN), not sure if the netdaq can digest those. They are not malformed, just strangely in the same packet.

[netdaq fail2.pcapng.zip](https://github.com/user-attachments/files/19045071/netdaq.fail2.pcapng.zip)

**Comment by Doridian** [comment]
> early in the init sequence, STOP 0x68 command is followed by an Error 0xFFFFFFFB response; any idea why ?

That is normal. When the instrument isn't running, STOP errors. That is why the error is ignored.


> both times, SET_CONFIG response is Error 0xfffffffe. I do see that the contents of the payload has changed

I wonder if this is because you have a 2640A, and some parts in the header for that model differ from the 2645A which I have. They do seem to support some different ranges?
If that is the case, you'd have to Wireshark the stock (demo) software with your instrument and see what all the settings mean in the packets.


> there is still that TCP packet with two concatenated requests (DISABLE_SPY and CLOSE_CONN), not sure if the netdaq can digest those. They are not malformed, just strangely in the same packet.

Likely this is the normal way of modern OSs which merge multiple small TCP packets in the same socket to one packet if they happen within a certain period of time.
I could set TCP_NODELAY I suppose to avoid this.

**Comment by fenugrec** [comment]
> That is normal. When the instrument isn't running, STOP errors. That is why the error is ignored.

Ah I see. I was hoping to find error strings for these device status codes in flukDAQ but it's a bit convoluted, made little progress.

> I wonder if this is because you have a 2640A, and some parts in the packet for that model differ from the 2645A which I have. They do seem to support some different ranges for example, I think? 

That could very well be. I now have a few captures with flukeDAQ, attached is a short session with a variety of channel modes and ranges; also some 'skipped' channels. 
[2640A flukedaq wireshark captures.zip](https://github.com/user-attachments/files/19075732/2640A.flukedaq.wireshark.captures.zip)
Have not analyzed the Config block, it would be nice to have in the dissector but I ran out of time for that. Anyway I think it would be easier to implement as part of this library.

> //EDIT: I have now set TCP_NODELAY just in case the instrument doesn't like packets being merged, but since it happens after `SET_CONFIG` already failed, that is not the issue for this one at least.

Hm, maybe I got mixed up in my captures and tests, but it seems that had no effect, I'm still seeing the merged packets ? Anyway I agree it's unlikely to be an issue.

**Comment by Doridian** [comment]
I see, there is some length difference in the START packets, the `0x00 0x00 0x00 0x64` delimeter in the 2640A is somehow 16 bytes earlier, so 4 of the header integer are not present on that model.

Let me know if you see anything in the DLL for the config packet that skips some pieces of `SET_CONFIG` conditionally. That should be a good giveaway as to where the issue lies.

**Comment by fenugrec** [comment]
> Let me know if you see anything in the DLL for the config packet that skips some pieces of `SET_CONFIG` conditionally. That should be a good giveaway as to where the issue lies. Or maybe uses different sizes or a different struct entirely?

that part of the code is challenging to analyze for a dumb reason : the 'interesting' stuff is not in the DLL but in the EXE (makes sense), but that program is compiled with certain options that makes the decompilation absolutely unreadable (briefly, it uses EBP as a fixed global pointer, and ghidra is [not equipped](https://github.com/NationalSecurityAgency/ghidra/discussions/5186) to deal with this)

> //EDIT: Alternatively, I could probably figure this out from two packet dumps: One with interval time and alarm time both enabled, set to 1.5 seconds. Then a second one with both set to 3 seconds.

Will do, possibly later today. I know the 2640 and 2645 have very different maximum measurement rates, maybe the scaling for time parameters is also different...

**Comment by fenugrec** [comment]
Ok I have it figured out. the DCV 50V range was causing problems. I haven't checked if other ranges differ between 2640 and 2645.
